{"adapterCases":[{"apiOperationId":"sample.get","contextBehavior":"active","credentials":[{"id":"primary","value":"sample-token"}],"endpoint":"https://api.example.test","expected":{"bodyCloseCalls":1,"bodyReadCalls":1,"outcome":{"success":{"apiOperationId":"sample.get","canonicalJSON":"{\"displayName\":\"Sample\"}","hasJSON":true,"httpStatus":200,"responseBody":"json"}},"providerCalls":1,"request":{"body":null,"headers":[{"name":"authorization","value":"Bearer sample-token"}],"method":"GET","url":"https://api.example.test/samples/sample-1"},"transportCalls":1},"maxResponseBytes":1024,"name":"success-json","providerBehavior":"values","request":"{\"id\":\"sample-1\"}","transport":{"behavior":"response","body":"{\"displayName\":\"Sample\"}","closeBehavior":"success","headers":[{"name":"content-type","value":"application/json"}],"readBehavior":"all","status":200}},{"apiOperationId":"sample.get","contextBehavior":"active","credentials":[{"id":"primary","value":"sample-token"}],"endpoint":"https://api.example.test","expected":{"bodyCloseCalls":1,"bodyReadCalls":24,"outcome":{"success":{"apiOperationId":"sample.get","canonicalJSON":"{\"displayName\":\"Sample\"}","hasJSON":true,"httpStatus":200,"responseBody":"json"}},"providerCalls":1,"request":{"body":null,"headers":[{"name":"authorization","value":"Bearer sample-token"}],"method":"GET","url":"https://api.example.test/samples/sample-1"},"transportCalls":1},"maxResponseBytes":1024,"name":"success-json-one-byte","providerBehavior":"values","request":"{\"id\":\"sample-1\"}","transport":{"behavior":"response","body":"{\"displayName\":\"Sample\"}","closeBehavior":"success","headers":[{"name":"content-type","value":"application/vnd.sample+json"}],"readBehavior":"one-byte","status":200}},{"apiOperationId":"sample.none","contextBehavior":"active","credentials":[],"endpoint":"https://api.example.test","expected":{"bodyCloseCalls":1,"bodyReadCalls":0,"outcome":{"success":{"apiOperationId":"sample.none","canonicalJSON":"","hasJSON":false,"httpStatus":204,"responseBody":"none"}},"providerCalls":1,"request":{"body":null,"headers":[],"method":"GET","url":"https://api.example.test/health"},"transportCalls":1},"maxResponseBytes":1,"name":"success-none-close-panic","providerBehavior":"values","request":"{}","transport":{"behavior":"response","body":"must-not-be-read","closeBehavior":"panic","headers":[],"readBehavior":"forbidden","status":204}},{"apiOperationId":"sample.get","contextBehavior":"active","credentials":[{"id":"primary","value":"sample-token"}],"endpoint":"https://api.example.test","expected":{"bodyCloseCalls":1,"bodyReadCalls":1,"outcome":{"error":{"apiOperationId":"sample.get","category":"external","code":"sample_not_found","domain":"api","httpStatus":404,"message":"sample was not found","pointer":"","reason":"","remoteCode":"not_found","remoteDetailsAbsent":true,"remoteDomain":"sample","requestId":"remote-request","retryable":false,"traceId":"remote-trace"}},"providerCalls":1,"request":{"body":null,"headers":[{"name":"authorization","value":"Bearer sample-token"}],"method":"GET","url":"https://api.example.test/samples/sample-1"},"transportCalls":1},"maxResponseBytes":1024,"name":"mapped-remote-error-close-failure","providerBehavior":"values","request":"{\"id\":\"sample-1\"}","transport":{"behavior":"response","body":"{\"apiVersion\":\"nexa.dev/remote-error/v1\",\"code\":\"not_found\",\"details\":{\"resource\":\"sample-1\"},\"domain\":\"sample\",\"message\":\"sample was not found\",\"requestId\":\"remote-request\",\"traceId\":\"remote-trace\"}","closeBehavior":"failure","headers":[{"name":"content-type","value":"application/json; charset=UTF-8"}],"readBehavior":"all","status":404}},{"apiOperationId":"sample.get","contextBehavior":"active","credentials":[{"id":"primary","value":"sample-token"}],"endpoint":"https://api.example.test","expected":{"bodyCloseCalls":0,"bodyReadCalls":0,"outcome":{"error":{"apiOperationId":"sample.get","category":"input","code":"request_invalid","domain":"nexa.sdk.api","httpStatus":0,"message":"API request is invalid","pointer":"/id","reason":"field_required","remoteCode":"","remoteDetailsAbsent":true,"remoteDomain":"","requestId":"","retryable":false,"traceId":""}},"providerCalls":0,"request":null,"transportCalls":0},"maxResponseBytes":1024,"name":"request-field-required","providerBehavior":"values","request":"{}","transport":{"behavior":"response","body":"{\"displayName\":\"Sample\"}","closeBehavior":"success","headers":[{"name":"content-type","value":"application/json"}],"readBehavior":"all","status":200}},{"apiOperationId":"sample.get","contextBehavior":"active","credentials":[{"id":"primary","value":"sample-token"}],"endpoint":"https://api.example.test","expected":{"bodyCloseCalls":0,"bodyReadCalls":0,"outcome":{"error":{"apiOperationId":"sample.get","category":"external","code":"credential_provider_error","domain":"nexa.sdk.api","httpStatus":0,"message":"credential provider failed","pointer":"","reason":"provider_failed","remoteCode":"","remoteDetailsAbsent":true,"remoteDomain":"","requestId":"","retryable":false,"traceId":""}},"providerCalls":1,"request":null,"transportCalls":0},"maxResponseBytes":1024,"name":"provider-failure","providerBehavior":"failure","request":"{\"id\":\"sample-1\"}","transport":{"behavior":"response","body":"{\"displayName\":\"Sample\"}","closeBehavior":"success","headers":[{"name":"content-type","value":"application/json"}],"readBehavior":"all","status":200}},{"apiOperationId":"sample.get","contextBehavior":"active","credentials":[{"id":"primary","value":"sample-token"}],"endpoint":"https://api.example.test","expected":{"bodyCloseCalls":0,"bodyReadCalls":0,"outcome":{"error":{"apiOperationId":"sample.get","category":"external","code":"transport_error","domain":"nexa.sdk.api","httpStatus":0,"message":"API transport failed","pointer":"","reason":"round_trip_failed","remoteCode":"","remoteDetailsAbsent":true,"remoteDomain":"","requestId":"","retryable":false,"traceId":""}},"providerCalls":1,"request":{"body":null,"headers":[{"name":"authorization","value":"Bearer sample-token"}],"method":"GET","url":"https://api.example.test/samples/sample-1"},"transportCalls":1},"maxResponseBytes":1024,"name":"transport-failure","providerBehavior":"values","request":"{\"id\":\"sample-1\"}","transport":{"behavior":"failure","body":"","closeBehavior":"success","headers":[],"readBehavior":"forbidden","status":0}},{"apiOperationId":"sample.get","contextBehavior":"active","credentials":[{"id":"primary","value":"sample-token"}],"endpoint":"https://api.example.test","expected":{"bodyCloseCalls":1,"bodyReadCalls":0,"outcome":{"error":{"apiOperationId":"sample.get","category":"external","code":"transport_error","domain":"nexa.sdk.api","httpStatus":0,"message":"API transport failed","pointer":"","reason":"round_trip_failed","remoteCode":"","remoteDetailsAbsent":true,"remoteDomain":"","requestId":"","retryable":false,"traceId":""}},"providerCalls":1,"request":{"body":null,"headers":[{"name":"authorization","value":"Bearer sample-token"}],"method":"GET","url":"https://api.example.test/samples/sample-1"},"transportCalls":1},"maxResponseBytes":1024,"name":"response-and-failure","providerBehavior":"values","request":"{\"id\":\"sample-1\"}","transport":{"behavior":"response-and-failure","body":"unused","closeBehavior":"success","headers":[{"name":"content-type","value":"application/json"}],"readBehavior":"forbidden","status":200}},{"apiOperationId":"sample.get","contextBehavior":"active","credentials":[{"id":"primary","value":"sample-token"}],"endpoint":"https://api.example.test","expected":{"bodyCloseCalls":1,"bodyReadCalls":1,"outcome":{"error":{"apiOperationId":"sample.get","category":"external","code":"remote_protocol_error","domain":"nexa.sdk.api","httpStatus":200,"message":"API response is invalid","pointer":"/body","reason":"response_body_read_failed","remoteCode":"","remoteDetailsAbsent":true,"remoteDomain":"","requestId":"","retryable":false,"traceId":""}},"providerCalls":1,"request":{"body":null,"headers":[{"name":"authorization","value":"Bearer sample-token"}],"method":"GET","url":"https://api.example.test/samples/sample-1"},"transportCalls":1},"maxResponseBytes":1024,"name":"body-read-failure","providerBehavior":"values","request":"{\"id\":\"sample-1\"}","transport":{"behavior":"response","body":"unread","closeBehavior":"success","headers":[{"name":"content-type","value":"application/json"}],"readBehavior":"failure","status":200}},{"apiOperationId":"sample.get","contextBehavior":"active","credentials":[{"id":"primary","value":"sample-token"}],"endpoint":"https://api.example.test","expected":{"bodyCloseCalls":1,"bodyReadCalls":1,"outcome":{"error":{"apiOperationId":"sample.get","category":"external","code":"remote_protocol_error","domain":"nexa.sdk.api","httpStatus":200,"message":"API response is invalid","pointer":"/body","reason":"response_body_too_large","remoteCode":"","remoteDetailsAbsent":true,"remoteDomain":"","requestId":"","retryable":false,"traceId":""}},"providerCalls":1,"request":{"body":null,"headers":[{"name":"authorization","value":"Bearer sample-token"}],"method":"GET","url":"https://api.example.test/samples/sample-1"},"transportCalls":1},"maxResponseBytes":10,"name":"body-size-limit","providerBehavior":"values","request":"{\"id\":\"sample-1\"}","transport":{"behavior":"response","body":"{\"displayName\":\"Sample\"}","closeBehavior":"success","headers":[{"name":"content-type","value":"application/json"}],"readBehavior":"all","status":200}},{"apiOperationId":"sample.get","contextBehavior":"canceled","credentials":[{"id":"primary","value":"sample-token"}],"endpoint":"https://api.example.test","expected":{"bodyCloseCalls":0,"bodyReadCalls":0,"outcome":{"error":{"apiOperationId":"sample.get","category":"canceled","code":"operation_canceled","domain":"nexa.sdk.api","httpStatus":0,"message":"API operation was canceled","pointer":"","reason":"context_canceled","remoteCode":"","remoteDetailsAbsent":true,"remoteDomain":"","requ